P_lim,U_lim,Daily_Procurement_Cost,Daily_Distribution_Cost,Daily_Holding_Cost,Daily_Freshness_Penalty,Total_Daily_Cost,Strategy,Description,Crossdock_Time,Is_Next_Day
2,2,17865.67,5295.88,188.94,2465325.0,2488675.5,Hyper-Fresh,"High Cost, Max Freshness",6:00,True
2,5,15288.61,943.44,200.4,234780.0,251212.45,Local-Batch,"Local Sourcing, Min Logistics",5:30,False
3,3,16451.73,1741.46,132.83,369200.0,387526.02,Balanced,Mid-range Sourcing,5:30,False
4,3,16451.73,1741.46,132.83,369200.0,387526.02,Bulk-Farm,"Farm Sourcing, Optimized Logistics",5:30,False
5,2,17865.67,5295.88,188.94,2465325.0,2488675.5,JIT-Farm,"Farm Sourcing, High Frequency",6:00,True
